1,  Morty! You gotta come on. Jus'... you gotta come with me.
1316,What are you doing here? W-why are you dressed like a waiter? Screw it. We don't have time. Come on.   
1319,"Man up, Jerry! I may need you to work the lasers. "
1321,I guess they really do have concentrated dark matter. 
1323,"Yeah. Yeah, yeah, yeah. Uh, check the engine room. We just need cesium, Plutonic quarks, and bottled water. "
1325,"Wow, Morty. Lucky break. Grab that bucket. Okay, two parts Plutonic quarks, one part cesium. "
1327,"Now empty the water bottle into the bucket and pour it all into the fuel tank so we can get the hell out of here! What are you doing, Morty?! There's no time! "
1329,"Oh, no. "
1334,You simulated my grandson's genitalia?! Y-y-you bunch of diabolical sons of bitches! 
1337,"All right. Okay. All right, great. Wonderful. You win. Can we go home now? "
1343,"Hey, Jerry, don't worry about it. So what if the most meaningful day of your life was a simulation operating at minimum capacity? "
1345,"Maybe you're right, Jerry. Maybe you're right. "
1353,"Why don't you ask the smartest people in the universe, Jerry? Oh, yeah. You can't. They blew up. "
1364,"Hey, Morty. "
1366,"Hey, little buddy. H-h-how you doing in here right now? "
1368,"Y-y-you're a good kid, Morty. Y-you're a real l-little c-character, Morty. "
1370,"You know, I had a really rocky road today, M-Morty. You're my little friend, aren't you? We had some good times together, huh, M-Morty? We You're a real true hero out in the field. You're a... You're a real trouper, huh, M-M-Morty? "
1372,"I really appreciate you, Morty. "
1374,  You little son of a bitch! Y-y- are you a simulation?! Huh?! Are you a simulation?! 
1376,You little son of a bitch! 
1379,"I-I-I'm sorry, Morty. Y-you're a good... You're a good kid, Morty. "
1381,Y-you're a good... You're a good kid.   
1389,Run! 
1392,"Morty, do it! Hit the button now! "
1394,"  Morty, I already told you, it's not your family! They're clones from an alternate reality possessed by demonic alien spirits from another dimension's future! Do you need a mnemonic device or something? Just hit the button already! "
1399,"Good work, Morty. "
1403,"  Y-You know, these demonic alien spirits are really valuable! "
1405,"You okay, Morty? Told you not to trust that tuna. "
1407,"I dunno, Morty. Some people would pay top dollar for that kinda breakthrough. "
1410,"Whoa whoa whoa,   come on, Morty! D-D-Don't be like that! The universe is a crazy and chaotic place! "
1412,"Oh yeah, Morty. Yeah, t-t-that- that's real easy to say from the sidekick position. But--But, uh, h-how about next time you be in charge, then we'll talk about how simple and fun it is. "
1414,"Okay, fine. But let's make it interesting, Morty. I-I-If your adventure sucks, and we bail halfway through it, you lose the right to bitch about all future adventures. Plus, you have to do my laundry for a month. "
1416,Every 10th. 
1419,Washing dishes? 
1422,Yeah just don't do it. 
1425,"Wow. Hat trick. All right, Morty, let's put a pin in this. I got to help your pathetic family. "
1427,"Oh, Morty, you done did it this time. It's on. I can't wait to watch your adventure lay a huge fart. As for you dingdongs... This is a Meeseeks box. Let me show you how it works. You press this. "
1430,"You make a request. Mr. Meeseeks, open Jerry's stupid mayonnaise jar. "
1433,The Meeseeks fulfills the request. 
1437,And then it stops existing. 
1440,"Trust me, they're fine with it. Knock yourselves out just keep your requests simple. They're not gods. "
1463,"God, Morty, what a boring start to an adventure. Why didn't we just go to Kentucky?  "
1465,Can't wait.  
1468,"Oh, my God, so embarrassing. "
1471,Yeah. Beginner's luck. 
1503,"All right, Morty. We're in your stupid giant's castle. What do we do next? "
1506,"Uh-oh, Morty. Startin' to get a little hairy. What do you want to do, boss? "
1509,"Just give up, Morty. This is game over. I'll take us home right now. You just say the word. "
1513,"Oh, boy. He looks pretty bad down there, Morty. Looks like he's bleeding out. "
1520,"Ooh, boy, Morty, you're really showing me how it's done. Real straightforward and fun. "
1539,"Oh, great adventure, buddy. Rick and Morty go to giant prison. You know, if somebody drops the soap, it's gonna land on our heads and crush our spines, Morty. You know, it'll be really easy to rape us after that. "
1541,"How? They took my portal gun. This is an open-and-shut case, Morty. You know, what do you think's gonna happen, some magical angel's gonna show up and then-  "
1544,W-what the hell is he talking about? 
1548,"All right, Morty, looks like the portal gun's still working. You ready to head home? "
1550,"Morty, cut your losses. This is obviously awash.  "
1553,"Oh, boy, Morty. "
1555,"What do you say, Morty? "
1576,"Yeah, Morty, this is the part of the story everybody loves scaling down 650,000 oversized steps. "
1581,"What are you looking at, mother-  "
1585,"Yeah, yeah, yeah, how about some scotch whiskey? You got any of that around here? Or just a bunch of nonsense words? "
1588,25 shmeckels? I don't know how much I don't know what that is. Is that a lot? Is it a little? 
1593,"Morty, your adventure's in a spiral. For real, man, time to pull out. "
1595,"Uh, because it's lame? "
1597,Whatever.  
1649,"Read 'em and weep, fellas!   Oh, hey, Morty. Listen, I'm really sorry about all that stuff I said earlier about your adventure. I'm havin' a good time, Morty. It's not so bad.  "
1651,"We can't leave now, Morty. I'm on fire! "
1654,"Okay. Listen, Morty. I just won a bunch of shmeckels. Why don't we use 25 of them to pay slippery stair here for a ride back to the village, and then we'll give the rest of the shmeckels to the villagers, huh? "
1656,"Sure, Morty. Yeah. You know, a good adventure needs a good ending.  "
1679,"Good job, Morty. Looks like you won the bet.  "
1681,"Well, you know, maybe that's why it could use a little cleaning up every now and then, you know. This one's wrapped up neat and clean because we did it Morty style. "
1693,What the hell happened to this place? 
1695,"Hey, it's not my fault that Jerry's an idiot. "
1698,"Well, you know, I do have a Fleeseeks box. "
1700,"What? It just has a mop and some floor wax in it. Wubba lubba dub dubs!   Yeah! That's my new thing! I'm kind of like what's his name Arsenio. Isn't that it's what Arsenio used to say on his show. Wobble gobba lop bops! Right? See you next week, everybody. "
1720,"""I should get her pregnant, and then she'll have to marry me ,"""
1722,"Sorry, please proceed with your story about banging my daughter in high school, I'm not sure you want to take romantic advice from this guy, Morty, His marriage is hanging from a thread,"
1724,"Jerry, it's your house -- whatever you say it is is how it is -- but I think a blind man could see that Beth is looking for the door, I barely have a reason to care, and even I noticed,"
1726,"Listen, Morty, I hate to break it to you, but what people call ""love"" is just a chemical reaction that compels animals to breed, It hits hard, Morty, then it slowly fades, leaving you stranded in a failing marriage, I did it, Your parents are gonna do it, Break the cycle, Morty, Rise above, Focus on science,  "
1729,"Morty, hand me that screwdriver, huh? I'm almost finished making my ionic defibulizer, Morty, It's gonna be great,"
1731,"Morty, that's such a poor use of my time, It's beneath me, Hand me the screwdriver,"
1733,"  You're growing up fast, Morty, You're growing into a real big thorn straight up into my ass, Listen, this is called oxytocin, I extracted it from a vole, Do you know what a vole is, Morty? You know what a vole is? It's a -- it's a rodent that mates for life, Morty, This is the chemical released in a mammal's brain, you know, that makes it fall in love, All right, Morty, I just got to combine it with some of your DNA,"
1735,"A hair, Morty, I need one of your hairs, This isn't ""Game of Thrones,"""
1737,"All right, Morty, Whoever you smear this stuff on will fall in love with you, and only you, forever, Are you happy now, Morty?"
1739,"W-w-w-what am I, a hack? Go nuts, Morty, It's foolproof, Eh, unless she has the flu,"
1778,"Well, Summer, there's always the possibility that she made the whole work thing up, Maybe Davin's digging around in her insides,"
1780,"Well, she's my daughter, Summer, I outrank you, Or family means nothing, in which case don't play that card,"
1784,"Not for the men they cheat on, no,"
1787,"I'm sorry, Summer, Your opinion means very little to me, How come you're not at this stupid dance everyone loves so much?"
1791,"Uh-oh,"
1801,"Morty, come on! We got to get you out of here, You're not gonna believe this because it usually never happens, but I made a mistake,   Come on, Morty, We got to get out of here, Come on,"
1809,"I didn't realize when I gave you that serum that Jessica had the flu -- you know, t-t-t-t-t-t-t-that might have been valuable information for me, Morty,"
1811,"What does it look like? T-t-t-the serum is piggybacking on the virus, It's gone airborne, Morty,"
1813,"It's gonna be fine, Morty, relax, I whipped up and antidote, It's based on praying-mantis DNA, You know, praying mantises are the exact opposite of voles, Morty, I mean, they -- they mate once, and then they, you know, decapitate the partner, I mean, it's a whole ritual, It's really gruesome and totally opposite, There's no love at all, I-I-I basically mixed this with a more contagious flu virus, It should neutralize the whole thing, Morty, It'll all be over very shortly,"
1815,"Uh, by the way, Morty, I know you didn't ask or anything, but I'm not interested in having sex with you, These serums, they don't work on anybody related to you genetically,"
1817,"Okay, well, sometimes, science is more art than science, Morty, A lot of people don't get that,"
1833,"Yeah, it's pretty wild how fast that spread, I've really outdone myself,"
1835,"Yeah, I don't know what I was thinking, Mantises are they opposite of voles? I mean, obviously, DNA's a little more complicated than that, You know what, though, Morty? This right here's gonna do the trick, baby, It's koala mixed with rattlesnake, chimpanzee, cactus, shark, golden retriever, and just a smidge of dinosaur, Should add up to normal humanity,"
1861,"Take a good look down there, Morty, and soak it in, because, you know, once I pull this lever, it's all back to normal,"
1863,"Well, technically, Morty, there's no rush, I mean, you know, o-once it's fixed, it's done, It's fixed, You know, we could -- we could just enjoy it for a little bit, I mean, l-l-l-look at how crazy it is, I mean, Morty, w-w-when's the next time you're gonna see something like this? I mean, soak it in, you know? It's -- it's pretty neat, It's pretty interesting,"
1865,"W-what do we have here, Morty? Looks like I was right and you were wrong, huh? I-I-I-I-I-I-I bet you feel pretty stupid right about now, huh? I-I-I bet you feel like the world's smallest man that you were doubting me about this whole thing, Morty,"
1869,"Bet you're loving this, Morty, This must be the best day of your life, You get to be the mayor of I told you town,  "
1885,"Boy, Morty, I really Cronenberged the world up, didn't I? We got a whole planet of Cronenbergs walking around down there, Morty, A-at least they're not in love with you anymore, though, That's a huge step in the right direction,"
1887,"Me irresponsible?! You -- all I wanted you to do was hand me a screwdriver, Morty! You're the one who wanted to be -- wanted me to buckle down and make you up a... roofie-juice serum so you could roofie that poor girl at your school, I mean, g-- w-w-w-w-w-- w-- are you kidding me, Morty? You're gonna try to take the high road on this one? Y-y-y-y-you're a little creep, Morty, Y-you're a -- you're -- you're -- you're just a little creepy... creep person,"
1889,"All right, all right, Morty, You know, w-w-w-we are in a pretty deep hole, here, but I do have one emergency solution that I can use that'll kind of put everything back to normal, relatively speaking, Here, Morty, put this on while I do a little bit of scouting,"
1892,"Come on, Morty, Luck had nothing to do with it, I'm great, That's the real reason, Now, Morty, what do you say, buddy? Will you hand me a screwdriver so I can finish my ionic dis-- defibulizer?"
1894,"All right, Morty, Thank you very much, We got one screw turn... and two screw turns... and... All right, Morty, here we are,"
1896,"Calm down, Morty! Look at me! Calm down, Morty!"
1898,"Calm yourself, Morty,"
1900,"Morty, Calm down, Morty,"
1901,"You got to calm down, Morty,"
1903,"Shut up and listen to me! It's fine, Everything is fine, There's an infinite number of realities, Morty, and in a few dozen of those, I got lucky and turned everything back to normal, I just had to find one of those realities in which we also happen to both die around this time, Now we can just slip into the place of our dead selves in this reality and everything will be fine, We're not skipping a beat, Morty, -Now, help me with these bodies,"
1905,"Look, Morty, I'll grab myself, you grab yourself, okay? I mean, t-t-t-that seems fair to me -- I mean, that seems like a fair way to divvy it up,"
1907,"What about the reality where Hitler cured cancer, Morty? The answer is don't think about it, It's not like we can do this every week, anyways, We get three or four more of these, tops, Now, pick up your dead self and come on, Haste makes waste, I-I-I don't suppose you've considered this detail, but obviously, if I hadn't screwed up as much as I did, we'd be these guys right now, so, again, you're welcome,"
1912,"Here we are, Cronenberg Morty -- a reality where everyone in the world got genetically Cronenberged, We'll fit right in, Cronenberg Morty, It'll be like we never even left Cronenberg world,"
1914,"Don't you worry about that sort of thing, Cronenberg Morty, Let's go make ourselves at home, huh? "
1915,"Look, I'm not paying 70 smidgens for a broken defraculator,"
1917,"Well, does it defraculate?"
1919,"Then -- then -- then it's a broken defraculator,"
1921,"Yeah, yeah, and your species eat sulfur, So, let's say 60 smidgens, I tell you what -- I'll do you a favor, I'll throw in a fart,"
1923,"Not here, Morty, We'll stop somewhere else, because, you know, there's always another pawn shop,"
1925,"Oh, it looks cool, huh? That's why you want it?"
1927,"Okay, 60 for the resonator, and my grandson wants the sex robot,"
1930,"I don't know, What do you want from me? He thi-- he thou-- he thou-- he th-- he thought it looked cool, You know what I mean?"
1937,"Where's the sex robot, Morty?"
1939,"Strange -- that's usually the man's job, You know what I'm talking about, Morty? Wubba-lubba-dub-dub!   Come on, you rascal,"
1942,"All right, Uh-oh,"
1944,"Hmm, I think Morty's robot was designed for more than long weekends, Genetic compiler, incubation chamber, Yep, This here's some kind of baby maker, and that there's half Morty, half buurp Who -- who knows wh-what? It's my bad, guys, I'll -- I'll take care of it,"
1948,"Hey, listen -- you guys quarantined the house when Summer brought olives back from Mexico, I mean, this thing could grow to the size of Delaware, I mean, it might eat brains and exhale space aids, We got to be careful,"
1950,Don't name it!
1952,"Oh, crap, He named it,"
1956,"Fine, I'm gonna take this thing to my workshop and do a little bit of investigating, Do not let that thing out of your sight, It looks harmless now, but it could grow into something dangerous,"
1958,"Yeah, Good one, Jerry, 2003 just called, It wants its easy target back,"
1966,"Well, I can't solve the problem my way, thanks to your family's primitive biological hang-ups, Gross, I might have just touched one of Morty's loads, But maybe I can find suitable parents for Morty Jr, on this robot's home world, which is... Gazorpazorp in the Andromeda system Scoot, Summer,"
1968,"I don't do adventures with chicks, Summer,"
1970,"Oh, crap,"
1973,Still think it's a good idea to go through holes without a wiener?
1975,"Yeah, no duh, Ugh!"
1977,"Great, Now I have to take over a whole planet because of your stupid boobs,"
1989,"Thanks, dum-dum,  "
1990,"I said, ""Rhanks, dum-dum,"" Go get more, Summer, put your burka on!"
1992,"Look, I'm trying to repair a p-portal gun with a bunch of sex-doll parts, and I have to do it one-handed to keep these belushis from carting you off, The least you could do is be ashamed of your gender,"
1994,"Obviously, at some point, the Gazorpians became so evolved that they replaced females with birthing machines, The resultant lack of distraction and hen-pecking allowed them to focus entirely on war, so they bombed themselves back to the stone age, and now they just fight with each other over fake bleep with sticks and rocks all day long,"
1996,"You ever see a line for the men's room? Are you hear-- do you li-- do you hear me, Summer?"
1999,"The plot thickens,"
2001,"Uh, you might want to cover your eyes, Summer,"
2004,"Summer, grab -- grab hold,"
2006,Aaaah!
2008,"Well, obviously, Summer, it appears the lower tier of this society is being manipulated through sex and advanced technology by a hidden ruling class, Sound familiar?"
2010,"Oh, there -- there we go, Summer, Hey -- hey, brother, Hey, bro, Nice racket you got going on here, Listen, I'm Rick Sanchez from Earth dimension C-137, Don't mean you any harm, Coming in peace, It's all cool in the, uh -- ""Good in the neighborhood"" is what I was trying to come -- is what I meant, Oh, I get it -- the old behind-every-great-man Amazon twist,"
2017,"  Ugh! Ohh! Oh-ho-ho! Oh, boy, What's the opposite of ""Wubba-lubba-dub-dubs""? Am I right, ladies and gentlemen? Are you guys kidding me?"
2031,"Wait a minute, We're here because a male Gazorpian was born on our planet,"
2038,"We don't have time for Mojitos,"
2040,"I don't care, Summer! This place is the worst! I want to go home!"
2042,"Yeah, You know what I have to say about that?"
2046,"  Whoo, boy! Who let the frogs out, huh?"
2048,"It's not dominated by us, okay? On Earth, men and women are equals,"
2051,"Whoa! Was this really the time to make that point, Summer?"
2071,"Because I got -- I got a big, you know, penis between my legs, What -- what -- what are you in for?"
2076,"Pfft! This is gonna be cake, No, Jackie!"
2078,"What, what, what -- a night on the couch?"
2080,"Ooh, gerp,"
2083,Holy shit! Y-y-you're gonna crush us with a boulder?!
2085,"What? Just give me a gun, I'll kill myself,"
2087,"Look, I'm sorry, Summer, I feel bad that I let you drag us into this, I wish I could have been a better grandpa to you, and, you know, for what it's worth, that is a really nice, cute top that you're wearing there,"
2095,"Good job, Summer, and thanks, girls, You know, you girls are really something, I'll tell you that, You know when we first got there, I was like -- Give them a ship now,"
2124,"Out of the -- out of the way, Morty!"
2126,"Morty, that's one of the most violently aggressive creatures in the universe!"
2146,"Isn't it interesting, Summer, that after all that stuff we just did, nothing really mattered and there was no point to it? Kind of makes you wonder, huh -- about nothing?"
2148,"No, I'd say, given what we've been through, that I was right the whole time and any epiphanies about gender politics were a projection of your feminine insecurity, But, hey, why don't you have a pink spaceship? Go ride around and have a jolly old time, Maybe that'll shut you up,"
2152,"Oh, that's interesting, Beth, You know, it's funny, I-I-I heard about a little bit of news myself, Take a look, T-take a listen,"
2154,"Wubba-lubba-dub-dubs! This this world still got a -- it's still got a chance! Yeah! Ha ha! See you -- see you guys next week! See everybody next week,"
2170,"Well, if it's any consolation, Summer, none of it mattered and the entire show was stupid,"
2172,"Thought you'd never ask,"
2176,How about Showtime Extreme in a world where man evolved from corn?
2180,"Summer you just spent three months watching a man chose a fake wife,"
2182,"Jerry, you don't get it, This is infinite TV from infinite universes, Look,"
2184,"A movie about a guy eating shit, A violent antique show,"
2189,"I agree, Where is this going?"
2191,"Really? All right, fine,"
2193,"All right, Jerry, When you're right, you're right, Now I'm hooked,"
2196,"Amazing -- a dimension where all proper nouns begin with ""Shmla,"""
2198,"All right, that actually got old pretty quick,"
2200,"Infinity's a big number, Jerry, I don't remember the channel,"
2202,"Geez, Actor Jerry: You speak the true-true,"
2207,"Infinite timelines, infinite possibilities, including a timeline where Jerry's a movie star, Look, you guys are getting excited about the wrong aspect to this device, Wha -- look at this,"
2220,"Now, who wants to watch random, crazy tv shows from different dimensions, and -- and then who wants to narcissistically obsess about their alternate selves?"
2222,"  Here, these scan your retinas and let you view parallel timelines through genetically matching versions of your eyes, Go fetch,"
2225,I'm proud of you Morty 
2252,"Yeah, it's got an almost improvisational tone,"
2268,"Hey, do we have any wafer cookies? Mmm! Oh, boy, Looks like you guys have been checking out alternate lives and realizing you don't have it as good, huh? That's too bad, You know, me and Morty are having a blast, We just discovered a show called ""Ball Fondlers,"" I mean, I don't want to rub it in or anything, but you guys clearly backed the wrong conceptual horse,"
2269,"I'm in heaven right now,"
2279,"Interesting fun fact -- Moynihan and a piece of toast hate each other, Apparently, they've got some real creative differences,"
2282,"Relax, Morty, Don't -- don't worry about it, Let's just see where this goes,"
2285,"Huh, He's making himself a sandwich now,"
2288,"Oh, my god, It's still the commercial,"
2296,"Hey, isn't Gazorpazorp where -- where those sex robots came from? Remember that whole thing?"
2298,"Yeah, Let's watch some more Gazorpazorpfield,"
2305,"No, Morty, it's Lorenzo Music, In this reality, he's still alive,"
2307,"Yeah, I'm pretty sure, He also did the voice of that one guy from ""Ghostbusters,"" which is really strange because it's the same character Bill Murray played in the movie, But then, when they made the movie, Bill murray did the voice of Gazorpazorp-- or Garfield, I mean,"
2309,"I don't know, Just making conversation with you, Morty, What, you think I'm a -- I'm -- I know everything about everything?"
2320,"Well, you know, Morty I mean, you want to sell boxes of cereal, you got to pump the gas a little, Pedal to the metal, Morty,"
2323,"Sex sells, Morty,"
2331,"Speaking of what, Morty what should we watch next? What about this? Detective: Babylegs, you're a good detective, But not good enough, because of your baby legs, So I'm partnering you up with regular legs,"
2347,"Pretty cool, huh, Morty?"
2349,"I don't give a bleep What you think, Jerry,"
2375,"Oh, hey, Morty, You just missed a preview for your dad's ""Citizen kane,"""
2381,"Come on, Are you kidding me, Jerry? It's just a bunch of dumb tabloid crap,"
2385,"Wh-- what are you asking me for, Jerry? I'm sitting here trying to figure out why the cops don't just take you out, I mean they got a clear shot to your head, I can't believe our tax dollars pay for this,"
2390,"Hey, ""Ball Fondlers""? Huh, ""Ball Fondlers""?"
2396,"Yes, sweetie, That's where the live,"
2399,"Look, I don't know, I'm watching the same thing you guys are,"
2401,"I don't know, Summer, I can't even hear the TV, All right, that's it, We're just gonna go there so you idiots can ask your stupid questions all day,"
2406,"Whatever,"
2408,"Well, scientifically, traditions are an idiot thing,"
2414,"Pass the butter, Thank you,"
2418,"I'm busy,"
2420,"Uh, anything else, Robot: What is my purpose?"
2421,"You pass butter,"
2423,"Yeah, welcome to the club, pal,"
2424,Since when you have a job?
2426,"Meow, Can't wait to meet this Fascinating character,"
2433,"Huh,"
2435,"Eh, I make my own stuff, So, what are you -- like, the devil?"
2437,"I don't know, Store comes out of nowhere, all the shit's old and creepy, Are you the devil? A demon? Leprechaun?"
2439,"Hey, I'm not judging, Just like shoot straight, I'm a man of science,"
2464,"Hey, Morty, let me--let me-- let me ask you a question real quick, Does evil exist, and if so, - can one detect and measure it?"
2466,"Rhetorical question, Morty, The answer's ""yes, you just have to be a genius,"" Cute, Your sister's boss gave me a microscope that would have made me retarded,"
2468,"Morty, I'm not disparaging the differently abled, I'm stating the fact that if I had used this microscope, it would have made me mentally retarded,"
2470,"Well, that's retarded,"
2472,"Apparently, nothing,"
2477,"Stay scientific, Jerry,"
2480,"This serum should counteract the negative effects,"
2482,"Here, You can have this back,"
2484,"Sure I did -- to develop this, It detects and catalogs all your ""Twilight Zone,"" Ray Bradbury, ""Friday the 13th"" the series voodoo crap magic, I thought you might want it so you didn't accidentally sell anybody, say,,, A typewriter that generates best-selling murder mysteries and then makes the murders happen in real life? Ooh,"
2486,"Don't you want to make sure people know what they're getting? You're not intentionally selling,,, Beauty cream that makes ugly ladies pretty but also makes them blind?"
2488,"Oh, I say, good sir, Oh, harrumph, Oh, oh"
2491,You know it's gonna be wearing you in three hours?
2493,"Here, you can use my phone, Don't worry, It won't make you deaf because I'm not a hack, You think you're bleep so great, you stupid piece of bleep shit,"
2495,"You work for the devil,"
2499,"Whoops,"
