1,  Morty! You gotta come on. Jus'... you gotta come with me.
2541,"Have you acquired creepy specific old stuff from a mysterious antique or thrift store that gives you powers but bleep with you in unforeseeable ways? Bring it to ""Curse Purge Plus,"" I use science to un-curse the items for cash, and you get to keep the powers, This guy got mysterious sneakers to make him run faster, but guess what? He would have had to run until he died, making them worthless, I removed the curse, making them worth, like, I don't know, $8 million, See you at the olympics, This eerily intelligent doll was threatening to murder its family, Now it does their taxes, Everything's deductible, Don't pay for cool stuff with your soul, Pay for it with money, You know, like how every other store in the world works? We're located at first and main in old town, Come on -- come on down, ""first and,,,""   ,,,""needful things,"" where you can get evil items for free!"
2574,"Looks like we've got,,, haunted boxing gloves that will make you the heavyweight champion in 1936, and then you'll be trapped there, winning the same fight for eternity, I can take out the ""eternity"" And the padding, and then you'll have some time-traveling mittens, Oh, look, it's Rosemary's baby, How's business?"
2576,"Sounds like code for ""You win, Rick,"""
2578,"Nope, It was important to your dumb devil friend, To me, this was all just a bit, like when Bugs Bunny bleep With the opera singer for 20 minutes,"
2580,"Seriously? Holy crap, Holy crap,"
2582,"Uh-huh, yeah, I don't care,"
2586,"I always do,"
2588,"Yeah, it is good, It's the best,"
2590,"Later,"
2592,"Yeah, uh... give me a sec,"
2594,"All right, yeah, put -- put them on my,,,eh, I just got bored, Everybody out,"
2609,"Hey, Morty, you want to go on a ,,, oh, Hey, Beth, Hello? Hey, Jerry, you in here being stupid?"
2611,"Thanks, Hey, you know, I was thinking, you know, I might watch a movie,"
2613,"Suit yourself, buurp   Hey,Hey, W-w-what's going on?"
2615,"Whatever,"
2656,"How's your pretend grandpa doing, aka ""the devil""?"
2658,"Oof, Sorry,"
2660,"Not sure,"
2662,"No, that's dumb,"
2664,"I'll tell you what, though, If -- if -- if it's satisfaction you're after, I think I might have an idea,"
2670,Stupid motherbleep
2672,Stupid motherbleep How do you like that? How do you like that?
2680,"It was totally worth it, We did it, We just pulled it off,"
2685,Martin Luther King Jr.'s birthday.
2689,"Oh, there's no need to do that, Beth. Regular pancakes are fine."
2694,"Oh, I get it. Regular pancakes are already shaped like flying saucers.   Mmm, I should be making you breakfast for putting up with me."
2698,Rick Sanchez of Earth dimension C-137. You are under arrest for crimes against alternate Ricks by the authority of the transdimensional council of Ricks.
2700,Neutralise the Jerry.
2706,"Everybody relax. If I know these a-holes, and I am these a-holes, they just wanna haul me to their stupid clubhouse and waste my time with a bunch of questions. Let's get it over with."
2707,Bring his mo-buurp-orty.
2709,Leave my buurp Morty out of this!
2710,You lost the right to have a say in these things when you refused to join buurp the council. 
2712,Will you at least unfreeze my daughter's idiot?
2720,The citadel of Ricks. It's the secret headquarters for the council of Ricks.
2722,"As you know, Morty, I've got a lotta enemies in the universe that consider my genius a threat. Galactic terrorists, a few sub-galactic dictators, most of the entire intergalactic government: wh-wherever you find people with heads up their asses someone wants a piece of your grandpa. And a lot of versions of me on different timelines had the same problem. So a few thousand versions of me had the INGENIOUS IDEA OF BANDING TOGETHER like a herd of cattle or a school of fish or those people who answer questions on yahoo answers."
2724,"Geez, you're easy to impress. Yeah, most timelines have a Rick and most Ricks have a Morty. This place is a real who's-who of who's you and me."
2725,"Turn your boring old Morty into a hot fashion statement, with some Morty dazzlers!"
2726,"Hey, check this out!"
2729,Dumb.
2730,"'Scuse me, sir, is your Morty insured? You know, every year hundreds of Mortys are injured in-"
2731,"Back off! Not my cup of tea, this place."
2733,I say the point of being a Rick is being a Rick. 
2734,"Save your anti-Rick speech for the council of Ricks, terror-Rick!"
2735,"Hey, save your Rick rules for the buurp sheep-Ricks, Rick-pig!"
2736,"bleep me, pal."
2737,"bleep you? No no no no no, bleep me!"
2739,Bring up the holograms!
2741,"Twenty-seven Ricks brutally murdered in their own timelines. An unprecedented Rick-icidal epidemic. What say you, Earth Rick C-137?"
2742,You think I did this? Why am I the first Rick you pull in every time a Rick stubs his toe?
2743,You buurp have a history of non-cooperation with the council. 
2744,"Yeah, so does the scientist formerly known as Rick! Wh-wh-wh-why isn't he here in handcuffs?"
2745,Because he's dead too!
2747,"Who else would you have us question? You fit the profile. Of all the Ricks in the central finite curve, you're the malcontent. The rogue."
2748,I'm the Rick. And so were the rest of you before you formed this stupid alliance. You wanted to be safe from the government so you became a stupid government. That makes every Rick here less Rick than me. 
2750,"Yeah, murmur it up, d-bags. Now if you'll excuse me, I've got pancakes back home with syrup on top of them. They're about to hit that critical point of syrup absorption that turns the cakes into a gross paste. And I hate to get all Andy Rooney about it, but I think we all like fluffy discs of cake with syrup on top! And I think we also like to be accused of crimes when there's evidence! So as they say in Canada, peace oot!"
2751,Evidence? Good idea. Scan his portal gun!
2753,"Oh, come on. Don't look at another man's portal gun history. We-we all go to weird places. "
2754,"Yes, but it appears you alone have been going to the exact timelines and locations in which the murders occured!"
2756,What? That's Rick-diculous. I'm obviously being set up! 
2757,"Earth Rick C-137! The council of Ricks sentences you to the machine of unspeakable doom, which swaps your conscious and unconscious minds, rendering your fantasies pointless while everything you know becomes impossible to grasp. Also every ten seconds it stabs your balls."
2758,I've heard enough.
2760,"Run, Morty!"
2766,Nooo!
2767,Arrrrgh! Ahhhh!
2768,Aaaah!
2769,Oof!
2786,They could have gone into any one of these.
2792,That'll keep 'em buurp busy for a while.
2794,"'Course not, Morty! How could that profit me? Someone out there is killing Ricks, and the council ain't gonna stop thinking it's me until we clear our names."
2796,By finding the real Rick killer.
2798,"Not really my style, Morty. Besides, your home is most likely swarming with Ricks right now. "
2800,"Alright, listen, Jerry. If Rick calls, this device is going to trace his location. You just gotta keep 'em on the phone for thirty seconds or longer. "
2802,"Oh yeah! Mmm! Oh, delicious!"
2803,"Beth, buurp you're a treasure. "
2804,"I have a Beth just like you in my buurp reality, except you know what? She's not as brilliant or buurp attractive!"
2806,Ohohoho! She did it! She did it!
2809,"Hey Jerry, it's Rick."
2811,"So listen, the heat's on and buurp there's nowhere left to turn so Morty and I are just going to fly my spaceship into a black hole."
2813,"Is that cool with you, dog?"
2815,I got it! The call's coming from... inside the house!
2818,The Ricks are probably gonna waste some time messing with Jerry. They won't be able to help themselves. But as soon as they get bored they'll be on to us.
2820,"Yeah, more phonesticks please."
2823,"Yeah, it's gotta be that way. You're a camouflage."
2825,"Ricks have a very distinct and traceable brainwave due to our genius. The best way to hide from an enemy's radar is to stand near someone with complementary brainwaves that make ours invisible. See, wh-wh-when a Rick is with a Morty, the genius waves get cancelled out by the uh,   Morty waves."
2827,"Oh, shit dog! My portal gun was hacked remotely Morty, obviously by the real killer to frame me. But I was able to trace the signal. Come on, let's go!"
2829,Uh-oh!
2830,"'Scuse me, we've tracked a pair of dangerous criminals to this exact location. They look exactly like us, so in order to avoid confusion I'm going to mark us each with a red X right now. That way if someone has a gun and we both tell you to shoot the other one because they're the evil one, you'll know who's lying. "
2831,"Hey, check it out!"
2833,Dammit!
2836,The red X! Red X!
2838,"Hey, it's a good thing that space outlet had labcoats and your favourite kind of shirt in stock, huh Morty?"
2840,"Man, this place is wayyy off the grid. This guy does not wanna be found."
2842,"Morty, you're making a bigger deal out of this than it is. "
2845,"Not people, Morty. Mortys."
2848,"Well, one Morty's enough to hide from the bureaucrats. But you g- you get a whole matrix of Mortys and put 'em in agonising pain. That creates a pattern that can hide even from other Ricks, motherbleep. I fiddled with a buurp concept like this once."
2850,"On paper, Morty, on paper! I wouldn't do this, it's barbaric overkill. I mean, you could accomplish the same result with like five Mortys and a jumper cable.   Which I also wouldn't do! I'm just saying, it's bad craftsmanship."
2856,Hi Jerry! 
2858,"Oh, you are? Wh-wh-what do you do?"
2860,"Advertising? Wow! So, people need help figuring out what to buy and then y-you help them?"
2862,"Well, I mean, you do it, and you seem like a guy that really has it all together!"
2864,"Oh gosh, wh- I hope not! I-I-I-I wouldn't want to offend you in any way!"
2866,Ohoho! Y-of course I am! Just as much as my Morty's a Morty!
2869,"That's right, Jerry! He-he's from a reality where everyone is Eric Stoltz mask people! He's Eric Stoltz mask Morty! They assigned him to me because... I never had any kids of my own. But if I did, boy, I'd love 'em  if they were as smart and as successful as you are, Jerry."
2871,"Hey, get a load of this! Jerry's hanging out with doofus Rick. "
2872,"Haha, this is perfect. "
2873,I'm not doofus Rick! I'm Rick J-19-Zeta-7! 
2874,"Oh, is that the timeline where everybody eats poop? Jerry, you know this guy eats poop, right?"
2875,Hey! I don't eat poop! Y-you guys are always so mean to me!
2877,"I guess it's only fair to tell you now, Jerry... I'm the worst Rick of them all."
2879,"Wow, you really are wise, Jerry. I-I guess that's why you work in advertising!"
2883,"Hey, it's your choice to take it personally, Morty. Now for the love of god, be quiet! The point of this is to get the drop on the guy! "
2885,"Yeah, that's right! You are! You're a perfect impenetrable sheet of human armour, Morty! Because you're as dumb as I am smart! Which is why when I say 'shut up' it's really good advice."
2887,"Great, nice work, Morty. "
2889,Urrgh.
2891,"Ooh, look at you, C-137! You're- aren't you a tough customer? "
2892,"The slow clap? Really? Kinda played out, dude."
2893,"Not in this dimension it isn't. In fact, hah, I invented it and nobody else has ever even done it here before. "
2894,Well lah-dee-dah.  
2895,"Hey, that's mine!"
2897,"I don't like the look of that Rick, Morty. We gotta escape."
2899,"Don't be Rickdiculous, Morty."
2901,Take his Morty away.
2910,"Ahh, isn't it beautiful? "
2911,"Yeah, yeah, looks like payday at Neverland ranch in here. Zing!"
2913,That guy got it.
2914,"Ah-ah Rick, quiet. You're missing my symphony."
2916,"Hey, I'll take it over Mumford and Sons. Zip!"
2918,This guy is on it!
2919,"He's not laughing at your dumb jokes, Rick. That's just a random noise it makes every ten seconds."
2921,Awww.
2922,"See, Rick, you're not as clever as you think you are. I wanted you to find me. We're not so buurp different, you and I."
2924,"Yeah, duh!"
2925,"See this right here, Rick? I crunched the numbers, I created a spectrum of all the Ricks. I listed 'em out from most evil to least evil. Here's where I am. And look at right here's where you are, Rick. This guy right here? Super weird."
2926,"I get it. So you want me to team up with you to take down the council of Ricks, right? Is that where you're going with this? 'Cause that's where I'd be going."
2927,"Please. I think I'm doing pretty good on my own. I'm simply going to download the contents of your brain, and then kill you."
2929,"Okay, if we add a little more titanium nitrate, and just a tad of chlorified tartrate: ovenless brownies! "
2932,"Well, come on, I can't take all the credit, Jerry. It was your idea. C'mere Jerry!"
2937,"You know Jerry, I'm not gonna tell you that these will increase in value, or even hold their current value. The truth is... you bought 'em 'cause you like 'em. They have value to you. That's what matters."
2939,Until we find your Rick.
2960,"You've lived quite a life, Rick. It's a real shame you're not gonna be around to see it through."
2962,You're crying? Over a Morty? 
2963,"No, I'm just allergic to dipshits."
2964,"Ugh, pathetic. We both know that if there's any truth in the universe, it's that Ricks don't care about Mortys."
2966,"Do your worst, you little bastards! Kill me! Do it! Do it!"
2968,Morty! Get me out of this! Come on!
2971,"Point taken, but this is buurp no time for arcs. "
2973,"Yeah, hello?"
2974,"Hey, what do me and O.J. not have in common? "
2975,Huh? Wh-who is this?
2976,"I found the real killer, biitch! Get over here!"
2978,Yo ding-dong! We're done here. Time to go. 
2979,"Well Jerry, I buurp guess this means goodbye. "
2981,"Jerry. W-we both know it wouldn't work. It's time to go back to our lives. I love you, Jerry. I love ya."
2985,"They'll go back to their families, attend school regularly, play video games, date girls... poor little Rickless bastards."
2987,"Earth Rick C-137, the council apologises for its false accusation. And in the way of reparations for our terrible mistake, we would like to compensate you with this voucher for a free replacement Morty, in the event that buurp your current buurp Morty should-"
2988,"Uh, guys? Not a good time. Come on, Morty, let's hit it."
2992,"Alright, Morty, don't break an arm jerking yourself off."
2994,"Hey Morty, you want connection? Go be part of some stupid club like all those dumb Ricks. You know, maybe I don't connect because I'm the Rickest Rick there is. And you know, it would buurp go without saying that the Rickest Rick... would have the Mortyest Morty."
2996,"Yeah, it would. Did you hear me say it?"
2998,"Just don't get too big for your loafers, Buster Brown. A cocky Morty could lead to some big problems. Could be a real bad thing for everybody."
3000,I-I-I'll explain when you're older.
3002,What a mess...
3003,Pride cometh before the fall. I guess he got what he deserved.
3006,Hand me the laser defibrillator. 
3007,"Hey guys! Uh, c-can I help?"
3008,No! Go clean the toilets! Maybe you'll make friends with some turds!
3009,You make us ashamed to be ourselves!
3011,"My god! I've seen this technology before! This Rick was being controlled remotely, puppeteered by somebody else. This is the receiver!"
3012,"Yeah, but where's the transmitter?"
3017,"Wubbalubbadubdub! Oh. Hey Jerry. Wh-wh-what are you doing in my room, buddy?"
3019,"Alright. Okay, get out. "
3021,"What's that dipshit doing out there? Are you friends with him? You know he eats his own shit, right? Oh my god, this is rich! I've got like buurp ten Ricks to call right now!"
3025,"Have fun, you two,"
3029,"I know, c-can we wrap this up? Morty and I have some synthetic laser eels oxidizing in the garage,"
3034,"Listen, you have my word as a caregiver, everything's gonna be fine, And if not, like you say, no more adventures or whatever, It's like that old song ""Blomp blomp-a noop noop a-noop noop noop,"" Y-you guys know that song? From Tiny Rogerts? You never heard of it? You know, the black effeminate guy from the '50s? No-nobody? A-all right, whatever, Look, who cares? Just go on your stupid trip,"
3043,"Uh, Summer, you can't have a party,"
3045,"Because I'm having a party, b-i-i-i-itch!"
3048,"""Glip glop?"" You're lucky a traflorkian doesn't hear you say that,"
3050,"It's like the n-word and the c-word had a baby and it was raised by all the bad words for jews,"
3053,"That's why you party? Boy, you really are 17,"
3055,"To get wr-wriggedy wriggedy wrecked, son!"
3057,"Yeah, and you keep your awesome friends away from my canapes,"
3077,Birdperson!
3079,"Oh, there's an emergency, all right, A bleep emergency! When's the last time you got laid, 'pers?"
3081,"Then it's time to get your beak wet tonight, playah, Go have some fun out there birdp-- bird-- birdperson,"
3083,"Uh... people? Mm, six, Yo! What up, my glip glops?!"
3094,"Uh-huh, Yeah, No, no, to-totally,"
3096,Morty! Have you met Gearhead?
3098,"Morty here, he -- he would love to hear all about the gear wars,"
3101,"Oh, hey, Morty! H-have you -- have you met my buddy Scropon?"
3103,"Whoa, Morty, this guy's entire planet was destroyed, Have a little perspective,"
3105,Aw! Squanchy!
3107,"Squanchy, you can squanch wherever you want, man, Mi casa es su casa, dawg!"
3110,"Morty, listen -- we've had a lot of really cool adventures over the last year, but it's time to relax,"
3112,"Jesus, Morty, you're bumming me out, Can't we just pretend like everything's fine for a few hours, enjoy ourselves, and then worry about all this later?"
3116,"Knock it off, Slow Mobius!"
3119,"Well, what are you doing standing here, Morty? Go, Talk to her, Tonight, the only adventure you're on is your cusping manhood,"
3149,"Whoa, Not cool, Summer, This is a party, Everybody should be welcome,"
3151,"Oh, great, Who invited Abradolph Lincoler?"
3153,"It's not the same, Summer, Lincoler is a crazed maniac -- just a misguided effort of mine to create a morally neutral superleader by combining the DNA of Adolf Hitler and Abraham Lincoln, Turns out it just adds up to a lame, weird loser,"
3159,"Don't look at me, dude,"
3166,"Kick his ass, Brad! Kick his ass!"
3171,"I just did you a favor, Morty,"
3188,"Huh, Big star in the sky,   Oxygen-rich atmosphere, Giant testicle monsters, We'll be fine! Let's party!"
3191,"Oh, man, Y-you hear that, Morty? You really lucked out with Summer o-on that one,"
3193,"Relax, Morty, relax! It's gonna be fine, All we have to do is go out and find us some kalaxian crystals,"
3195,"Oh, shit, motherbleep kalaxian crystals, Morty, just a few miles south of here,"
3197,"Whoa, whoa, whoa, Morty, morty, I-I can't go with you, I got to hang back and make sure everything stays cool here, you know? I mean, who knows what -- what if somebody breaks something?"
3200,"Oh, hey, Morty, this is perfect! You can take Lincoler with you,"
3202,"Shut up, Lincoler, It's the least you can do for wrecking the living room,"
3233,"All right! You did it, Morty,"
3235,"Well, at least he didn't die in vain, He got these crystals,   And these babies just saved this lame-ass party! Wubba, lubba, dub, dub! Play something, S-somebody, play something,"
3238," Put your right foot forward   And your left foot back   Then slide around like on a nordictrack   Move to the left   Step to the right   Wiggle your elbows, and look up into the light   It's the, it's the   It's the Rick dance   It's the, it's the   It's the Rick dance "
3239,"Slow Mobius, hit me with the clock beam!    It's the, it's the   It's the Rick dance "
3240,"That's the Rick dance! All right! Whoa, man!"
3242,"What? No, no, no, I can get us home whenever I want to, But, listen, speaking of those crystals, can I get the rest of them? I'm starting to come down, Morty, Crystal kalaxian is a really strong, but fleeting high,"
3245,"Oh, Morty, you idiot! Does anybody else have any more k-lax? B-birdperson? Uh, squanchy? Don't squaunch at me,"
3247,"All right, all right, fine, Morty, you party pooper buzzkill! Boo, boo! Morty sucks!"
3249,"Boo! Morty, you're the worst, Morty,"
3293,"Huh? What? Wait? What? What? Stop,"
3295,"Uh, all -- all right, All right, Hold -- hold on,   Ahh! So good,"
3297,"Bring me the thing,"
3299,"The thing, The thing, The -- the -- it's got, like, buttons on it and lights on it, It -- it -- it beeps,"
3302,"Summer for -- for the win, All right, that should do it,"
3304,"Uh, s-see for yourself,"
3306,"Yeah, e-everything's frozen in time, Yeah, and Slow Mobius thinks he's all that,"
3308,"I don't know, How long do you guys want? A week? A month?"
3311,"Worst movie ever,"
3316,"Don't need to, I have a new catchphrase,"
3318,"I love my grandkids,"
3320,"Psych! Just kidding -- my new catchphrase is, ""I don't give a bleep""  Just shake that ass, bitch, and let me see whatcha got   Just shake that ass, bitch, and let me see whatcha got  Roll credits!  Just shake that a--  Roll the credits! Go!  Just shake that ass  That's the end of season one! That's the end, motherbleep ""I don't give a bleep"" is my new catchphrase! bleep you! That's season one! Boom! Season one up in your face, motherbleep Yeah!"
3338,Who cares about the buurp thing you guys are talking about? The whole point of freezing time is to stop giving a bleep. Put a shirt on your dumb dad and let's get this dumb universe rolling. Let's do this thing. 
3340,"Alright, listen, you two, we froze time for a pretty long time, so when I unfreeze it, the world's time is gonna be fine, but our time's gonna need a little time to, you know, stabilize. "
3342,"It means relax and stop being a pussy, Morty. I thought you learned that by now. It also means don't touch your parents or we could shatter into countless theoretical shards. "
3344,And away we go! 
3348,"Shhh, Morty! "
3351,"Negative visualization, Jerry. It explains a lot about where you're at. Hi, sweety. "
3358,"Yeah it would literally destroy them. Now listen, why do--why do--why--why don't you guys go get a free sunday ice cream,   go out there and get some ice creams. Here's five hundred dollars cash in unmarked moneys. I'm just gonna put it on the floor and uh, kick it on over to ya. You guys go nuts. "
3364,Uh oh. 
3371,"Man that guy is the Red Grin Grumble to pretending he knows what's going on.   Well guess what? I made him up. You really are your father's children. Think for yourselves, don't be sheep. "
3377,"Yup, it really makes you appreciate how fickle the universe can be.   One minute you're falling off a roof for six months, the next minute, bam! "
3383,"Actually, sorry Summer, I gotta back the M bomb on this one. I remember the conversation. We told Morty to replace all the bank's money with cookies, your job was to put the mattress under Mr. Benson. "
3395,Whoa whoa wh-what the hell hell hell hell hell? 
3397,"Oh God, oh no, what did you guys just do? "
3401,buurp Were either of you guys uncertain about anything just now? 
3406,"Alright both of you, just don't move, don't speak, don't think. I have to check something.  "
3415,Shut up!   Oh crap are you kidding me? Two dots? This never needs to be more than one dot. The two of you made us uncertain! 
3420,Our time is fractured. You two somehow created a feedback loop of uncertainty that's split our reality into two equally possible impossiblities. W-we're exactly like a man capable of sustaining a platonic friendship with an attractive female co-worker. We're entirely hypothetical. 
3422,"We're not on any timeline, dummy. Look. "
3426,"I assume they're Schrodinger's cats. A-actually, I assume they both are and aren't, just like us.  "
3428,"""Mom and Dad?"" Get your head out of your family's ass. The three of us are lost in a timeless oblivion. Your parents get to exist. They're probably living it up in some pointless grounded story about their bleep marriage. "
3451,"This is why you don't freeze time, you guys. It's incredibly irresponsible."
3454,"Look, there's no time to hold me accountable, Morty. Like literally no time. Look around. Uncertainty is inherently unsustainable. Eventually everything either is or isn't. And we've got about four hours to be ""is"". "
3457,"We ""isn't"" "
3458,"Alright, since this time crystal exists in both possibilities, and since it's impossible that I didn't nail this, I'm probably about to press this button in both possibilities at exactly the same time. "
3460,"Whatever you're asking, the answer is I'm amazing. And away we go! "
3462,"Huh, what do you know, it's working "
3465,Oh shit. 
3467,What the hell is wrong with you two!? I--I m--I m--I mean you four!? 
3469,"Good I'm glad it was painful. You do deserve it! I saw you, you're both buurp all over the damn place. We've been split for twenty minutes and your lives are already scattered to the quantum f ing wind? What the hell do either of you have to be so uncertain about? Your brand of zit cream? Which chair to sit in while I do everything? Come on, spit it out! "
3475,"Alright, cool it, I see what's happening here. You're both young, you're both unsure about your place in the universe, you both wanna be ""Grampa's favorite."" I can fix this. Morty sit here, Summer, you sit here. Now listen, I know the two of you are very different from each other in a lot of ways, but you have to understand that as far as Grampa's concerned, you're both pieces of shit. Yeah, I can prove it mathematically. Actually, let me grab my whiteboard. This has been a long time coming anyway. "
3497,"So in conclusion, you're both equally mercurial, overly sensitive, clingy hysterical bird brained homunculi. And I honestly can't tell the two of you half the time because I don't go by height or age, I go by amount of pain in my ass, which makes you both identical. Alright, everything resolved? Everybody nice and certain about their position in my world? "
3499,"Alright, perfect. Sit still, buurp arms down, I'm gonna do this again, this time, be like Grampa. "
3501,What's that? You got something to say? 
3502,And away we go! 
3504,And away we go! 
